<?xml version="1.0" encoding="Windows-1252"?>
<xs:schema xmlns="http://tempuri.org/rutas" elementFormDefault="qualified" targetNamespace="http://tempuri.org/rutas" xmlns:xs="http://www.w3.org/2001/XMLSchema">

	<xs:element name="rutas">
		<xs:complexType>
			<xs:sequence>
				<xs:element minOccurs="3" maxOccurs="unbounded" ref="ruta" />
			</xs:sequence>
		</xs:complexType>
	</xs:element>

	<xs:element name="ruta">
		<xs:complexType>
			<xs:sequence>
				<xs:element ref="nombre" />
				<xs:element ref="tipo" />
				<xs:element ref="medioTransporte" />
				<xs:element minOccurs="0" maxOccurs="1" ref="fechaInicio" />
				<xs:element minOccurs="0" maxOccurs="1" ref="horaInicio" />
				<xs:element ref="duracion" />
				<xs:element ref="agencia" />
				<xs:element ref="descripcion" />
				<xs:element ref="personasAdecuadas" />
				<xs:element ref="lugarInicio" />
				<xs:element ref="direccionInicio" />
				<xs:element ref="coordenadas" />
				<xs:element minOccurs="3" maxOccurs="unbounded" ref="referencias" />
				<xs:element ref="recomendacion" />
				<xs:element ref="hitos" />
			</xs:sequence>
		</xs:complexType>
	</xs:element>

	<xs:element name="nombre" type="xs:string" />
	<xs:element name="tipo" type="xs:string" />
	<xs:element name="medioTransporte" type="xs:string" />
	<xs:element name="fechaInicio" type="xs:date" />
	<xs:element name="horaInicio" type="xs:dateTime" />
	<xs:element name="duracion" type="xs:duration" />
	<xs:element name="agencia" type="xs:string" />
	<xs:element name="descripcion" type="xs:string" />
	<xs:element name="personasAdecuadas" type="xs:string" />
	<xs:element name="lugarInicio" type="xs:string" />
	<xs:element name="direccionInicio" type="xs:string" />
	<xs:element name="coordenadas">
		<xs:complexType>
			<xs:sequence>
				<xs:element name="latitud" type="xs:float"/>
				<xs:element name="longitud" type="xs:float"/>
				<xs:element name="altitud" type="xs:float"/>
			</xs:sequence>
		</xs:complexType>
	</xs:element>
	<xs:element name="referencias" type="xs:string" />
	<xs:element name="recomendacion">
		<xs:simpleType>
			<xs:restriction base="xs:integer">
				<xs:minInclusive value="0"/>
				<xs:maxInclusive value="10"/>
			</xs:restriction>
		</xs:simpleType>
	</xs:element>


	<xs:element name="hitos">
		<xs:complexType>
			<xs:sequence>
				<xs:element minOccurs="3" maxOccurs="unbounded" ref="hito" />
			</xs:sequence>
		</xs:complexType>
	</xs:element>

	<xs:element name="hito">
		<xs:complexType>
			<xs:sequence>
				<xs:element ref="nombreHito" />
				<xs:element ref="descripcionHito" />
				<xs:element ref="coordenadasHito" />
				<xs:element ref="distanciaDesdeAnterior" />
				<xs:element minOccurs="1" maxOccurs="5" ref="galeriaFotografica" />
				<xs:element minOccurs="0" maxOccurs="3" ref="galeriaVideos" />
			</xs:sequence>
		</xs:complexType>
	</xs:element>

	<xs:element name="nombreHito" type="xs:string" />
	<xs:element name="descripcionHito" type="xs:string" />
	<xs:element name="coordenadasHito">
		<xs:complexType>
			<xs:sequence>
				<xs:element name="latitud" type="xs:float"/>
				<xs:element name="longitud" type="xs:float"/>
				<xs:element name="altitud" type="xs:float"/>
			</xs:sequence>
		</xs:complexType>
	</xs:element>

	<xs:element name="distanciaDesdeAnterior">
		<xs:complexType>
			<xs:simpleContent>
				<xs:extension base="xs:float">
					<xs:attribute name="unidades" type="xs:string" use="required"/>
				</xs:extension>
			</xs:simpleContent>
		</xs:complexType>
	</xs:element>
	
	<xs:element name="galeriaFotografica" type="xs:string" />
	<xs:element name="galeriaVideos" type="xs:string" />
</xs:schema>